Kategorie,Titel,Beschreibung,Dauer
Social,Tut mir leid!,"Rufe jemanden an, bei dem du dich schon lange entschuldigen wolltest. Nimm' dir Zeit! Feedback posten: wie hat die Person reagiert? Wie fühlst du dich jetzt?",1800
Social,Klatschkonzert,"Stell dich um 19 Uhr auf den Balkon und klatsche für all die, die derzeit mit Herzblut die Kranken und Schwachen unter uns pflegen. Poste ein Video vom Klatschkonzert. Selbst wenn Du ganz allein im Hinterhof klatschst. Überwinde Dich!",300
Social,Unbekannte Komplimente,"Mache mindestens 2 Leuten ehrliche Komplimente. Aber: sie dürfen dir nicht näher bekannt sein! Der Nachbar, ein Mensch bei einer Hotline, aber auch Menschen aus dem öffentlichen Leben sein, denen du schon immer gerne deine Bewunderung aussprechen wolltest. Poste deine Einträge/ Komplimente und die Reaktionen darauf. ",900
Social,Vorlesen,"Lese jemandem Liebes, jung oder alt, aus einem deiner Wahl Buch vor. (Das geht auch über Audio oder Video)",1800
Social,Singen macht gute Laune,Ob in der Dusche oder in der Küche beim Kochen: Dreh' Musik auf! Sing (und tanz!) mindestens zu einem Lied deiner Wahl. Lass die Seele baumeln. ,900
Social,Mamas Kochbuch,"Koche dein Lieblingsrezept und teile die Idee. Mach ein Fotos. Teile mit deinen Freunden das Ergebnis, oder auch Misserfolge, denn geteiltes Leid ist halbes Leid!",3600
Social,Eine kleine Freude in 3 Minuten,Wem wünscht du heute Freude? Wer hat sie gerade besonders verdient? Nimm dir 3min Zeit und schreibe ihnen eine kleine Nachricht!,180
Social,Spenden macht froh,In der Coronakriese gibt es viele die weniger haben als wir! Sach- oder Geldspenden können helfen! Dabei kann alles Helfen. Auch wenn du selbst gerade nicht viel Geld hast. Spende doch die Summe eines Kaffees an das Café um die Ecke! ,600
Social,Brieffreundschaft,"Starte eine Brieffreundschaft, bevorzugt mit jemandem, den du noch nicht kennst! Interessiere dich für sein/ihr Leben. Seid für einander da! Tauscht euch aus. Im digitalen Medium der Wahl oder ganz oder altmodisch per Brief, das hat was besonderes.",1800
Social,Stille Wikipedia Post,"Lies einen beliebigen Wikipedia Artikel. Einen von einem Thema, das du nicht kennst. Erzähle mindestens 2 Freunden von deinem neu erlernten Wissen! Frage sie, wem sie das Wissen weitergeben.",1800
Social,Sozial von daheim,"Was kannst du heute von daheim aus Soziales tun? Ruf deine Großeltern an und erkunde dich bei ihnen nach ihrem Tag, oder eine Tante, bei der du dich schon länger nicht mehr gemeldet hast, oder such eine soziale Organisation, die du auch virtuell unterstützen kannst. Du wirst sehen, es gibt viele Möglichkeiten sich auch direkt von zu Hause aus zu engagieren. Bild der guten Tat von zu Hause aus posten.",1800
Social,Teilen macht glücklich,"Organisier eine Food Sharing Community in eurem Haus, um Euch in Zeiten der Krise gegenseitig unter die Arme zu greifen. Du möchtest einen Kuchen backen, hast aber kein Mehl mehr da? Vielleicht kann der Nachbar aus dem 2. Stock dir da ja aushelfen, der benötigt ohnehin Bananen, von denen du sowieso zu viele hast. All dies ohne unmittelbaren Kontakt zueinander. Teilt die geteilten Lebensmittel und Eure Erfolge.",1200
Social,Lokale Lokale,Bestelle in einem Lokal in deiner Stadt und unterstütze damit das Restaurant. Oder ordere einen Gutschein den du oder andere später einlösen können.,600
Art,Was liest Du gerade?,Was gibt es besseres als von Freund*innen ein Buch empfohlen zu bekommen? Was liest du denn gerade? Überleg dir ein Buch das dir besonders gut gefällt und teile den Titel mit der #HomeAloneChallenge Community! ,300
Art,Gib' eine Filmempfehlung!,Was gibt es besseres als von Freund*innen einen guten Film empfohlen zu bekommen? Überleg dir einen Film der dir besonders gut gefällt und teile den Titel mit der #HomeAloneChallenge Community!,300
Social,Schreibe einen Brief,"Schreibe einen netten Brief, egal, ob an deine eigenen Großeltern, oder andere ältere Menschen in deiner Nähe. Vielleicht sogar in deinem Haus. Ältere Personen sind stark betroffen vom Coronavirus, hilf Ihnen für einen Moment Ihre Sorgen zu vergessen. Nimm Papier und Stift und los geht's! Mach dir nicht zu viele Gedanken, die Geste zählt mehr als schönes Briefpapier oder tolle Verse - wobei nette Verse natürlich schön sein können, wenn du mit deinen eigenen Worten nichts zu Papier bringst.",1200