Kategorie,Titel,Beschreibung,Dauer
Art,Kleine Künstler,Zeichne ein Bild von dir in deinem nächsten Urlaub – im Stil einer Kindergartenkind-Zeichnung. Und schön bunt. Dann ab an den Kühlschrank dami!,1200
Art,Mach ein Foto von...,"Du hast einen grünen Daumen und möchtest dein Talent allen zeigen? Wenn du magst, teile ein Bild deiner Pflanzensammlung.",300
Art,Mach ein Foto von...,"Es ist es nun Zeit deine vierbeinigen Freunde vorzustellen.Wenn du magst, mache ein lustiges Bild mit deinem Haustier!",300
Art,Mach ein Foto von...,"Hallo an alle Meisterköche da draußen und all die, die es noch werden wollen. Es wird an der Zeit die besten Rezepte auszutauschen und sich gegenseitig kulinarisch zu inspirieren. Zeige uns in einem Bild oder Video dein Meisterwerk!",300
Art,Du Poet!,Schreibe ein kleines aber feines Haiku-Gedicht und veröffentliche es für die Community!,600
Art,Do it yourself,"Zeit kreativ zu werden. Setze deine Ideen beim Basteln, Nähen oder Malen um. Wenn du magst, teile dein Ergebnis mit der #HomeAloneChallenge Community.",3600
Art,Einsatz in 4 Wänden,"Du hast es satt, das Muster deiner Raufasertapete auswendig zu lernen? Zeit für einen Einsatz in deinen 4 Wänden. Suche nach Möglichkeiten, um dich wieder wohler in deiner Wohnung/deinem Haus zu fühlen. Ob Möbelumstellung, das Basteln von Dekorationen oder Aufhängen von Bildern, der Kreativität sind keine Grenzen gesetzt. Wenn du magst, zeige der Community deinen Einsatz!",5400
Art,Selbstportrait,"Male ein Portrait von dir – nur keine Hemmungen! Dann mach ein Selfie in der gleichen Pose und zeig der #HomeAloneChallenge Community, zu welcher Sorte von Malern du gehörst: Zu den Naturalisten oder doch eher den Expressionisten?",1200
Art,Die Zeit nach Corona,"Schreib auf, welche Dinge du nach der Coronakrise unbedingt tun möchtest und stelle sie bildlich dar. Häng das Bild danach an den Kühlschrank oder an die Wand. Wenn du magst, teile deine Liste mit der #HomeAloneChallenge Community!",900
Art,Mal ein Doodle,"Lass deiner Kreativität freien Lauf und zeichne einfach drauf los. Wenn du magst, teile dein Ergebnis mit der #HomeAloneChallenge Community!",900
Art,Blind vor Kunst,"Verbindet euch (Familienmitglieder, Mitbewohner, sonstige Personen in deinem Haushalt) die Augen und malt ein beliebiges Objekt, das der jeweils andere erraten muss. Teile das schönste Bild aus der Blind Artist Challenge mit der #HomeAloneChallenge Community! P.S. klappt auch wunderbar mit Freunden über Video-Calls ;)",1800
Art,Der nächste Bestseller?,"Du wolltest schon immer mal in die Fußstapfen von J.K. Rowling oder Mark Twain treten? Nun hast du die Gelegenheit dazu, beginne dein erstes Buch/ deine erste Kurzgeschichte. Möglicherweise hast du ja schon Ideen, die du gerne direkt in die Tat  umsetzen möchtest. Falls nicht, beginne in kleinen Schritten und denke dir für's erste mögliche Charaktere und einen Handlungsstrang aus. ",1800
Eco,Pflanzenprojekt,"Heb einen Avocadokern auf und fang ein neues Pflanzenprojekt an! Dokumentier es, sprich mit der Pflanze und tausch dich emotional aus. Du kannst ein Pflanzentagebuch schreiben und/oder die Fortschritte mit der #HomeAloneChallenge Community teilen.",600
Eco,Bio-Müll,"Schmeisst du deine Gemüsereste immer noch in die falsche Tonne? Jetzt ist der Zeitpunkt, dir einen Bio-Müll anzulegen Tipp: Falls du keine Bio-Mülltonne kaufen kannst, kannst du auch einfach eine Tupperdose nehmen! Der Müll schimmelt nicht, wenn du ihn in dein Gefrierfach stellst!",600
Eco,Nachhaltige Bildung,"Nimm dir mal etwas Zeit und informiere dich über Themen wie Zero Waste, dem Klimawandel oder der aktuellen Geopolitik. Es schadet nie, sein Wissen über unsere Zeit zu erweiter!",3600
Eco,Aus Alt mach Neu,"Suche einen Gegenstand in deinem Haushalt (Kleidungsstück, Leeres Marmeladenglässchen, ....) und werte es auf! Wenn du magst, teile ein Vorher-Nachher Bild deines upgecycelten Gegenstandes mit der #HomeAloneChallenge Community!",1800
Education,Bildung online,"Such dir eine kostenlose Online-Class (bspw. auf https://www.edx.org/) und befasse dich mit einem Thema, das du schon immer mal lernen wolltest. Wenn du magst, teile ein Bild von deines ausgewählten Kurses oder deiner bisherigen Lernerfolge mit der #HomeAloneChallenge Community!",600
Education,Neue Sprache lernen,"Lerne eine neue Sprache, am besten aus das Land, wo du gerne noch (nach der Krise) hinreisen möchtest (bspw. 10-20 Vokabeln). Wenn du magst, teile deinen Lernerfolg mit der #HomeAloneChallenge Community!",1800
Education,Bilingual,"Finde drei Wörter, die auf deutsch unglaublich lang und umständlich sind – wie ""Marmeladenglasdeckel"". Jetzt sieh zu, ob sie in anderen Sprachen vielleicht leichter sind – und integriere sie ab sofort in deinen Wortschatz! Lass die #HomeAloneChallenge Community deine Vorschläge hören!",900
Eco,Aus Alt mach Neu,"Suche 3-5 Dinge zusammen, die du eigentlich wegwerfen solltest – und kombiniere sie zu etwas Neuem – und wenn es ""nur"" ein Kustwerk ist. Wenn du magst, teile dein Kunstwerk mit der #HomeAloneChallenge Community!",3600
Fun,"Kleider machen Leute, oder vielleicht doch nicht?","Durchstöbere deinen Kleiderschrank nach deinen größten Mode-Sünden und stelle dir dein Worst-of-Kleiderschrank-Outfit für den Tag zusammen. Wenn du willst, teile schlimmstes Outfit mit der #HomeAloneChallenge Community!",600
Fun,Neunmalklug,"Lies einen zufälligen Wikipedia-Artikel vollständig durch, werde zum ""Experten"" für das Theme und ""nerve"" diverse Freunde und Bekannte mit einem neu erworbenen Wissen. Wenn du magst, teile dein Wissen mit der #HomeAloneChallenge Community!",1200
Fun,Verkleide-sich-wer-kann,"Als Kinder haben wir uns ständig verkleidet, warum nicht heute? Suche oder bastle Dir eine Verkleidung. Wenn du magst, teile ein Selfie deiner Verkleidung!",1800
Fun,Literaturkritiker,"Verfasse eine ehrliche Rezension, z.B. auf amazon.com zu einem Buch, das du letztens gelesen hast. Wenn du magst, teile auch deine Meinung zu dem Buch mit der #HomeAloneChallenge Community und post ein Bild deiner Rezension!",1200
Fun,Wohlfühloase,"Du brauchst einen Anlass um dich im Bad fertig zu machen? Hier ist er! Mach dich frisch für einen schönen Wohlfühl-Abend! Wenn du magst, teile ein Bild von dir mit der #HomeAloneChallenge Community!",1800
Fun,Verdrehter Tag,"Mach heute mal alles verkehrt herum! Abendbrot zum Frühstück, Tageszeitung beim Schlafengehen, – und was dir sonst noch so einfällt! Wenn du magst, teil deine Erfahrung mit der #HomeAloneChallenge Community!",28800
Fun,Das große Vorsprechen,"Lese eine vorab ausgewählten Text in verschiedenen Launen vor (Traurig, Wütend, Lustig). Wenn du magst, teile ein Video von deinen Vorlesekünsten mit der #HomeAloneChallenge Community!",900
Selfcare,Bestes Händewaschlied?,"Bring Schwung ins Händewaschen und finde ein neues Lied, um dich effektiv vor Viren zu schützen. Wenn du magst, teile dein Lieblingslied zum Händewaschen mit der #HomeAloneChallenge Community! (Alles außer Happy Birthday ist erlaubt)",300
Fun,Putz dich heraus!,"Geh auf ein Date mit dir selbst. Zieh dein Lieblingsoutfit an und/oder trag dein liebstes Make-Up auf. Heute geht es um dich und das darf die ganze Welt auch sehen. Wenn du magst, teile ein Selfie mit der #HomeAloneChallenge Community!",900
Fun,Heimkino,"Schaue einen Film inklusive passender Snacks und Softgetränke. Wenn du magst, teile ein Bild der Kinosession mit der #HomeAloneChallenge Community!",900
Selfcare,Rezepteneuling,"Versuche ein dir noch unbekanntes Rezept aus. Wenn du magst, teile das Rezept und ein Bild von dem Essen mit der #HomeAloneChallenge Community!",2700
Fun,Virtuelle Pantomime,"Rufe jemanden über die Videofunktion deines Handys/ Laptops an und versucht über Gesten gegenseitig unterschiedliche Begriffe zu erraten.Wenn du magst, teile ein Bild der witzigsten Pantomime mit der #HomeAloneChallenge Community!",1800
Fun,"Minigolf, warum nicht auch mal daheim?","Baue in deinem Haus einen Minigolf-Parkour auf (kreativ mit zB Besen als Schläger, Flasche als Ziel welches getroffen werden soll, etc) und spielt drauf los! Wenn du magst, teile ein Bild deiner persönlichen Minigolfanlage mit der #HomeAloneChallenge Community!",3600
Social,Übernachtungsclub,"Veranstalte eine Übernachtungsparty mit all den Bewohnern deines Haushaltes oder virtuell. Kocht euch was leckeres, sucht einen Film aus und tauscht euch über den neusten Klatsch und Tratsch aus. Wenn du magst, teile ein Bild der Übernachtungsparty mit der #HomeAloneChallenge Community!",3600
Social,"Abendessen für eins, zwei, drei, vier....","Organisiere ein gemeinsames Dinner über Whatsapp/Facetime! Sorge dafür, dass jeder deiner ""Gäste"" sein Essen zur gleichen Zeit fertig hat, dann trefft euch online um gemeinsam zu essen. Gerne könnt ihr euch auch dem Anlass entsprechend kleiden ;). Wenn du magst, teile einen Screenshot oder ein kurzes Video eures Dinners mit der #HomeAloneChallenge Community!",5400
Social,Video-Karaoke,"Finde ein paar Leute, sucht euch einen Song in Karaoke-Version (z.b. auf youtube) heraus – und lasst es krachen! Wenn du magst, film dich beim Karaoke und teile deinen Song mit der #HomeAloneChallenge Community!",1800
Art,Playlist-Teiler,"Erstelle eine (Spotify-) Playlist, gib ihr einen passenden Namen und teile sie mit der #HomeAloneChallenge Community.",1200
Household,Innerer Schweinehund,"Mache etwas, was du schon seit langem vor dir herschiebst (Ausmisten, Steuern, Dokumente sortieren). Wenn du magst, teile ein Bild von deines Erfolges mit der #HomeAloneChallenge Community!",3600
Household,Digitales Entrümpeln 1,"Lösche Fotos/Dateien/Programme von deinem Computer, die du nicht mehr benötigst. Wenn du magst, teile ein Bild deines ordentlichen und sortieren Desktops mit der #HomeAloneChallenge Community!",2700
Household,KonMari ,"Nimm dir ein Beispiel an Marie Kondo und sortier aus!  Wenn du magst, teile ein Bild deines sortierten und ausgemisteten Kleiderschranks mit der #HomeAloneChallenge Community! ",0
Selfcare,Auftanken,"Ermittle einmal, wie viel Wasser dein Körper am Tag so braucht. Bei Erwachsenen sagt man: Circa 30-40 Mililiter pro Kilogramm Körpergewicht. Dann stelle dir diese Menge in Form von Wasserflaschen, Teekannen etc. zusammen – und tanke den ganzen Tag über mal wieder so richtig auf.",28800
Household,Hab den Durchblick,"Putze deine Fenster, um wieder einen klaren Blick nach draußen zu haben und deinem Nachbarn auf dem gegenüberliegenden Balkon zuwinken zu können. Wenn du magst, teile ein Bild deiner Putzaktion mit der #HomeAloneChallenge Community!",1800
Fun,Blind vor Hunger,"Verbindet euch (Familie, Mitbewohner, sonstige Personen in deinem Haushalt) die Augen und versucht gegenseitig unterschiedliche Sachen aus eurer Küche blind zu erschmecken. Hierbei sind der kulinarischen Kreativität keine Grenzen gesetzt. Wenn du magst, teile ein Bilde der wildesten Kreation die du erschmecken musstest mit der #HomeAloneChallenge Community!",1800
Household,3 Minuten Liste,"Erstelle eine Liste, mit Dingen die du innerhalb von 3min erledigen kannst: Zähne putzen, Lüften, dein Bett machen, die Pfannen abwaschen, ein Bild malen... und tu es! Wenn du magst, lasse die Community an deiner 3-Minuten Challenge mit Hilfe eines Bildes teilhaben!",600
Physical,High Intensity Training,"Lass dich motivieren und absolviere ein 10-15-minütiges Ganzkoerper-Workout. Anregungen findest du auf Youtube: https://www.youtube.com/watch?v=MT1-jW1qwzg. Wenn du magst, teile ein Selfie von dir in Aktion mit der #HomeAloneChallenge Community!",900
Selfcare,Immer schön cool bleiben,"Stelle dir einen Timer und nimm eine 1-minütige kalte Dusche. Probier's es lohnt sich wirklich! Wenn du magst, teile deine Erfahrungen mit der #HomeAloneChallenge Community zu diesem Thema!",300
Selfcare,Frischluft,"Wenn du einen Balkon/Garten/Terasse hast, dann ab nach draußen mit dir! Nimm dort eine Mahlzeit zu dir oder lies ein Buch. Wenn du sowas nicht hast, dann such das größte Fenster in deinem zu Hause, reiß es auf uns setz dich mit einem Stuhl direkt für ein paar Minuten davor. Beobachte die Stille draußen und genieß die frische Luft, die reinströmt. Wenn du magst, teile ein Selfie von dir mit deinem Ausblick ins Freie mit der #HomeAloneChallenge Community!",1800
Selfcare,Keine Softdrinks,"Komme einen Tag lang ganz ohne Soft-Drinks (Cola, Sprite...) aus. Wenn du magst, teile ein Bild deines Alternativgetränks mit der #HomeAloneChallenge Community!",28800
Physical,Homeworkout,"Verbringe 10 Min mit Sport: Zum beispiel mit Jumping Jacks, Planks, Squads und Situps – oder suche dir direkt auf Youtube ein Workout-Video. Hau rein! Zeig uns anschließend dein verschwitztes Siegerlächeln mit einem Selfie.",600
Physical,Treppenhaus Challenge,"Laufe 1000 Stufen am Stück. Vielleicht findest du einen Ort draußen, aber falls du es im eigenen Treppenhaus machst, dann bitte nur allein und nicht mit dem ganzen Haus zusammen. Wenn du die Stufen nicht als ein Workout machen möchtest, kannst du sie auch verteilt über den Tag machen. Wenn du magst, halte den Moment bildlich fest, an dem du die 1000. Stufe meisterst und teile den Erfolg mit der #HomeAloneChallenge Community!",3600
Selfcare,Gehirnjogging,Lade dir eine Gehirnjogging App herunter und probiere ein Workout aus. Teile einen Screenshot deines Ergebnisses mit dem Hashtag #HomeAloneChallenge ,900
Physical,Namaste,"Lege eine kleine Yoga-Session ein. Falls du noch nie Yoga gemacht hast, nimm hierfür gerne YouTube Videos für Beginner zu Hand und leg los! Wenn du magst, teile ein Bild deiner liebsten Yoga-Pose (z.B herabschauender Hund) mit der #HomeAloneChallenge Community!",900
Physical,Bailando,"Tanzen macht glücklich. Deshalb: wirf dich in Schale, mach dein Lieblingslied an und tanz einfach darauf los. Wenn du magst, teile deinen Dance-Song mit der #HomeAloneChallenge Community – oder traust du dich gar, ein paar deiner Moves zu zeigen?",900
Physical,Homeworkout 2,"Verbringe 10 Min mit Sport: 3 Minuten mit jeweils 3 Runden Jumping Jacks; 10 Liegestütz und 10 Sekunden Wandsitzen – oder such dir auf Youtube ein Workout, das dir gefällt.",600
Physical,Bewegungsdrang,"Beweg dich mindestens eine Stunde am Tag, sei es durch Tanzen, auf der Stelle Joggen oder der nächsten Workoutchallenge daheim. Teile, wie du dich heute eine Stunde bewegt hast und inspiriere andere.",3600
Selfcare,Raise the awareness,"In sozialen Netzwerken wird einem oft das perfekte Leben vorgelebt. Dabei geht es nicht allen gut und viele leiden unter dem Druck perfekt zu sein. Überlege dir, wie du auf dieses Problem aufmerksam machen kanns. Wenn du magst teile ein Bild / eine Story um die sozialen Medien vielleicht etwas realer zu machen.",1200
Selfcare,Dankbarkeit,"Schreibe drei Dinge, für die du dankbar bist, auf einen Zettel auf und hänge den Zettel an die Decke über deinem Bett, um immer diese Dinge vor Augen haben zu können. Wenn du magst, teile diese 3 Dinge mit der #HomeAloneChallenge Community!",0
Selfcare,Meditation,"Gönne dir eine Auszeit und meditier für mindestens 10 Minuten (z.B. mit der App Headspace). Wenn du magst, teile danach ein Selfie mit der#HomeAloneChallenge Community in deiner coolsten Meditationspose!",600
Selfcare,Tagebuch führen,"Schreibe einfach auf, wie es dir heute geht – und lass deinen Gedanken freien Lauf.",1800
Selfcare,Einfach mal Kind sein,"Erinner dich zurück an deine Kindheit. Welche Serien hast du gerne geschaut, Welches Essen gerne gegessen? Es wird Zeit in Erinnerungen zu schwelgen. Wenn du magst, teile deine Erinnerungen mit der #HomeAloneChallenge Community.",1200
Selfcare,"Neuer Tag, neues Wissen!","Gehe auf youtube. Tippe ""tutorial"" ein und suche dir ein x-beliebiges heraus. Sieh es dir an und lerne etwas Neues!",1200
Selfcare,Mitgefühl-Meditation,Informiere dich online über die 5 Stufen des Mitgefühls – wäre das etwas für dich?,1200
Selfcare,Radikale Akzeptanz,"Was an deiner Situation ist besonders schwer zu akzeptieren? Schreibe auf, was dich daran stört. Sind andere Menschen in derselben Situation? Wie geht es denen? Wie lösen sie es? Was kannst du aus der Situation lernen? Wie kannst du jetzt besonders freundlich zu dir sein? ",900
Selfcare,Lächel doch mal,Beim Lächeln werden Endorphine freigesetzt. Lächel 3 Minuten beim durch die Wohnung laufen und denk an was Positives! ,180
Selfcare,10 Minuten Meditation ,Nutze die Zeit zu Hause und nimm dir 10 Min Zeit für dich.  Auf Youtube findest du eine Menge Anfänger-Mediatations-Tutorials.,900
Selfcare,Digitale Auszeit,"Der Wunsch connected zu bleiben ist groß, trotzdem tut es der Seele auch mal gut abzuschalten. Versuche ein digitales Timeout zu nehmen, in dem du nicht online gehst (weder mit dem Handy noch mit dem Tablet/Computer). Das digital Timeout sollte mindestens 4 Stunden dauern, du kannst es aber auch länger machen. Wenn du fertig bist, berichte der #homealonecommunity mit einem Foto, Video oder kurzem Post von deinem Timeout. (Pro Stunde ein Rewardpunkt)",14400
Selfcare,Musik in deinen Ohren!,Erstelle eine Musik-Playlist mit schönen Power-Songs zum Aufstehen – und lass dich morgen von ihnen wecken! Teile deine Playlist mit der #HomeAloneChallenge Community,1800
Selfcare,Spaßkanone,"Rufe jemanden via Videochat an - und lache so laut du kannst. Versuche, die andere Person mit deinem Lachen anzustecken!",900
Selfcare,3 Minuten Dankbarkeit pur,"Nimm dir drei ruhige Minuten, um an etwas zu denken, wofür du dankbar bist. Versuche es dir so detailliert, wie möglich vorzustellen. Versuche, dir das Gefühl zu merken. Wenn du die #HomeAloneChallenge Community an dieser intimen Erkenntnis teilhaben lassen willstt – gerne!",180
Selfcare,"3 Minuten ""Heute nicht""","Liste 3 Minuten lang Dinge auf, wieso du heute etwas schaffst – und was du damit erreichen möchtest! Teile deine Erkenntnis gerne mit der #HomeAloneChallenge Community",180
Selfcare,3 Minuten Ruhe,"Such dir den ruhigsten Ort in deinen 4 Wänden und setze oder lege dich hin, schließe für 3 Minuten die Augen und atme einfach tief ein und aus.",180
Selfcare,Luft Boxen,"Lass nun einfach all deine negative Energie raus! Wut, Angst, Energie..., alles darf nun verarbeitet werden. Sei es durch eine kleine Luft-Box-Session oder lauthalsigem Mitsingen eines traurigen Liedes. ",300
Selfcare,Tränen freien Lauf lassen,"Erlaube dir einmal ganz bewusst zu weinen, wenn du dich heute traurig fühlen solltest. ",600
Selfcare,Gegen die Wand!,"Nimm die ein Paar Socken. Stell dich etwa zwei Meter von einer Wand entfernt auf. Schließe die Augen und denke an das, was dich so richtig wütend macht – und dann baller' die Socken mit vollem Karacho gegen die Wand!",120
Selfcare,Der Urschrei,Wann hast du das letzte mal alles rausgelassen und so richtig rumgeschrien? Schnapp dir ein Kissen und brüll' dir alles von der Seele.,120
Selfcare,N I C H T S,"Heute ist gammeln einfach nur gammeln angesagt. Ein paar Stunden, so lange du willst -und das ist total okay. Wenn du magst, teile ein Bild von dir beim Gammeln mit der #HomeAloneChallenge Community!",7200
Selfcare,Verzeihe dir,"Denke an eine Entscheidung, die du bereust. Was hast du dabei gefühlt? Warum hat dein damaliges Ich so entschieden? Was ist jetzt anders? Verzeihe dir. Wenn du magst, teile ein Selfie, das diesen inneren Frieden veranschaulichen soll, mit der #HomeAloneChallenge Community!",1800
Selfcare,unplugged - einfach mal runterfahren!,"Probiere nun alle technischen Geräte für mindestens eine Stunde auszuschalten und dich einer Tätigkeit zu widmen, der du schon lange nachgehen wolltest. Einfach mal nichts tun ist aber auch erlaubt. Wenn du magst, teile diese Detox-Erfahrung in Form eines Bildes mit der #HomeAloneChallenge Community!",3600
Selfcare,Früh schlafen!,"Du schaust gerne Netflix-Serien bis spät in die Nacht oder verquatschst dich immer mit Freund*innen am Telefon. Wie wäre es denn einfach mal früher schlafen zu gehen? Deine Produktivität und Stimmung werden es dir am nächsten Tag danken. Wenn du magst, teile ein Selfie deiner frühen Abendroutine mit der #HomeAloneChallenge Community!",900
Selfcare,Verrückte Träume,"Von was hast du letztens geträumt, um was ging es, wer war dabei? Versuche es festzuhalten. Als Zeichnung, als Gedicht - Sei kreativ!",1800
Selfcare,Schutzhülle,"Schließe die Augen. Atme tief ein und aus; Kreiere deinen eigenen Schutzraum, ganz für dich allein. Hier herrschen keine physikalischen Gesetze. Hier gibt es keine Grenzen. Hier gibt es keine Gefahren. Hier bist du sicher! Versuche dir den Ort so detailliert wie möglich vorzustellen. Spüre, Rieche, Höre. Bleibe solange, wie du willst.",600
Selfcare,Dinner for one,"Führ dich selbst daheim zum Dinner aus. Koche dir dein Lieblingsgericht, werf dich in Schale und genieße den Abend. Teile dein Ergenis auf Social Media mit #HomeAloneChallenge",7200
Selfcare,"Etwas Vitamin D, bitte!","Ob auf dem Balkon, in deinem eigenen Garten oder am Fenster: Es ist nun wichtig, dass du nicht die Sonne meidest, sondern aktiv nach ihr suchst, um genug Vitamin D abzubekommen. ",900
Selfcare,Alkohol? Nein Danke!,"In Zeiten wie diesen kann ein Glas Wein oder ein Bier schnell die Stimmung wieder heben. Versuche aber mal für eine bestimmte Zeit auf den Alkohol zu verzichten, dein Körper wird dir danken. Zeig der #HomeAloneChallenge Community deine Alternative!",28800
Selfcare,Zeit für ein bisschen Spa,"Gönne dir mal ein bisschen Auszeit und nimm ein Bad, trag eine Maske auf oder zünde deine Lieblingskerze an. Teile dein Spa-Erlebnis auf Social Media mit #HomeAloneChallenge",0
Selfcare,Schenke Aufmerksamkeit,"Sei es um dein Haustier oder deine Pflanzen. Schenke heute alle denen deine Aufmerksamkeit, die es innerhalb deiner 4 Wände benötigen. Teile ein Bild deiner Pflanze, deines Haustieres oder was auch immer es in deinem zuhause gibt auf Social Media mit #HomeAloneChallenge",1800
Selfcare,Liebesbrief - mal anders,"Schreibe einen Liebesbrief an dich selbst. Was gefällt dir gut an dir selbst? Worauf bist du stolz? Was ist dir schon einmal besonders gut gelungen? Nimm dir die Zeit die du brauchst für deinen Liebesbrief, denk an die passende Anrede und einen liebenswürdigen Schlusssatz. Den Brief bewahrst du auf, sodass du ihn dir immer wieder ansehen kannst.",900
Selfcare,Gönn dir eine Auszeit,"Tue in den nächsten 10 Minuten einfach mal gar nichts, kein Handy, keine Musik, nichts außer die Stille um dich herum zu genießen. Fiel dir diese Aufgabe nicht leicht? Das macht nichts, mit der Zeit gewöhnst du dich daran, einfach mal wieder nichts zu tun. Teile deine Erfahrung auf Social Media mit #HomeAloneChallenge",600
Selfcare,Gönn dir Beauty,"Trage eine Gesichtsmaske auf, lackiere dir die Nägel in schönen Farben, oder gönn deinen Haaren eine Kur. Nimm dir Zeit für dich und deinen Körper, sei dabei entspannt und lasse dich voll drauf ein. Schau dabei kein Fernsehen und nutze nicht den Computer (ein Selfie ist natürlich erlaubt, wenn du magst!)",900
Selfcare,Sag Dankeschön,"Bestimmt gibt es jemand/en in deinem Leben, dem/der du schon immer einmal DANKE sagen wolltest. Jetzt ist die Gelegenheit dazu gekommen, verfasse eine Nachricht an eine Person deiner Wahl, bei der du dich schon lange bedanken wolltest.",300
Selfcare,Lies etwas,"War da nicht diese eine Buch oder dieser eine Artikel, dass du schon seit langem lesen wolltest, aber nie dazu gekommen bist? Wenn nicht, finde etwas, was dich interessiert, ganz egal um was es geht",86400
Selfcare,Plane deinen nächste Reise,"Gibt es irgendeinen Ort, den du schon immer sehen wolltest? Jetzt ist die Zeit, sich Gedanken darüber zu machen, wohin die nächste Reise geht, welche Sehenswürdigkeiten und Attraktionen dich interessieren und wie lange es dauern soll",10800
Selfcare,Digitales Entrümpeln 2,"Miste deinen Computer mal richtig aus. Welche Fotos haben keine Bedeutung für dich, welche Programme nehmen unnötig Speicherplatz in Anspruch und welche Dateien auf deine Desktop könnte man in einem Order sortieren?",7200
Selfcare,Tagesplan,"In Zeiten der Krise, ist es schwierig eine Routine beizubehalten. Das wird jetzt anders! Plane den morgigen Tag indem du dir gezielt Aufgaben setzt, die du erledigen möchtest (vielleicht ist ja auch eine kleine Challenge dabei? ;)).  Versuche so gut wie möglich den Ablauf des morgigen Tages zu planen (auf die Stunde genau). Hake morgen jede Zeile ab und belohne dich für den Erfolg. Wenn nötig passe deine Routine an.",900
Social,Schattenspiel,Ist es sonnig heute? Dann fotografiere den Schatten deines Fingerspiels. Kannst du die Gans oder den Wal? Wenn es keine Sonne gibt: eine starke Lampe und das Schattenspiel kann stattfinden.,600
Social,Ruf deine (Groß-)Eltern an,"Besonders ältere Leute fühlen sich in jetzigen Zeiten allein, ruf sie an, um das zu verändern! Mit wem hast du länger nicht telefoniert? Wer könnte sich einsam fühlen? Rufe deine Großeltern/Eltern an und frag sie wie es ihnen geht. Quatsch mit ihnen, über wichtige Dinge wie Versorgung und Gesundheit, aber auch über lustiges, wie was du als Kind angestellt hast, oder wie sie selber früher waren! Gibt es nicht auch Dinge, die du schon immer mal von ihnen wissen wolltest?",1800
Social,Alte Freunde,"Rufe einen alten Schulkollegen oder jemanden an, den du seit Jahren nicht mehr gesprochen hast. Was sind Dinge, an die Ihr euch gemeinsam erinnert? Was erstaunt dich an dem Anderen?",1200
Social,Eigenlob riecht gut!,Selbstfürsorge ist heute angesagt! Was hast du in der letzen Zeit gut gemeistert? Wofür hättest du schon lange mal Anerkennung verdient? Horche in dich hinein! Schreib dir einen Zettel mit deinem Lob an dich selbst!,900
